"id","fk_jogo","title","title","texto","large_text","te_modalidade","start_day"
"3060075","8842249","Vitória do Guijuelo sobre o Burgos Promesas 2000 com direito a goleada","Vitória do Guijuelo sobre o Burgos Promesas 2000 com direito a goleada","<p>O <a href=/equipa.php?id=13834>Guijuelo</a> derrotou o <a href=/equipa.php?id=54077>Burgos Promesas 2000</a> num duelo no sábado, por <a href=/match.php?id=8842249>3x0</a>, em jogo válido pela sétima rodada do <a href=/edicao.php?id_edicao=167018>Segunda División RFEF</a>. Nesta competição, o time do técnico Mario Sánchez vinha de um empate, e a equipe de Burgos vinha de duas derrotas.</p><p><a href=/player.php?id=278155>Álvaro Montero</a> fez o primeiro gol da partida, quando o relógio marcava os 19 minutos. <a href=/player.php?id=489864>Pepe Carmona</a> ampliou a vantagem quando o relógio assinalava os 44 minutos.</p><p><a href=/player.php?id=662944>Trapero</a> decretou o placar final, aos 72 minutos.</p><p>Com o resultado, o Guijuelo ocupa o primeiro lugar na <a href=/edicao.php?id_edicao=167018> classificação geral</a>, com 17 pontos, enquanto o Burgos Promesas 2000 encontra-se na décima oitava posição, 2 pontos. Na próxima rodada do Segunda División RFEF, o time do técnico Mario Sánchez <a href=/match.php?id=8842259> visita a casa do Ourense CF</a>, enquanto o time treinado por Carlos Aguilera Ruiz <a href=/match.php?id=8842258> recebe o SDC Polvorín</a>.</p>","<p>O <a href=/equipa.php?id=13834>Guijuelo</a> derrotou o <a href=/equipa.php?id=54077>Burgos Promesas 2000</a> num duelo no sábado, por <a href=/match.php?id=8842249>3x0</a>, em jogo válido pela sétima rodada do <a href=/edicao.php?id_edicao=167018>Segunda División RFEF</a>. Nesta competição, o time do técnico Mario Sánchez vinha de um empate, e a equipe de Burgos vinha de duas derrotas.</p><p><a href=/player.php?id=278155>Álvaro Montero</a> fez o primeiro gol da partida, quando o relógio marcava os 19 minutos. <a href=/player.php?id=489864>Pepe Carmona</a> ampliou a vantagem quando o relógio assinalava os 44 minutos.</p><p><a href=/player.php?id=662944>Trapero</a> decretou o placar final, aos 72 minutos.</p><p>Com o resultado, o Guijuelo ocupa o primeiro lugar na <a href=/edicao.php?id_edicao=167018> classificação geral</a>, com 17 pontos, enquanto o Burgos Promesas 2000 encontra-se na décima oitava posição, 2 pontos. Na próxima rodada do Segunda División RFEF, o time do técnico Mario Sánchez <a href=/match.php?id=8842259> visita a casa do Ourense CF</a>, enquanto o time treinado por Carlos Aguilera Ruiz <a href=/match.php?id=8842258> recebe o SDC Polvorín</a>.</p>","1","2022-10-15 23:59:59"
"3060079","8842246","Racing Santander B derrota o Bergantiños FC por 0x1","Racing Santander B derrota o Bergantiños FC por 0x1","<p>Em jogo válido pela sétima rodada do <a href=/edicao.php?id_edicao=167018>Segunda División RFEF</a>, o <a href=/equipa.php?id=8470>Racing Santander B</a> bateu o <a href=/equipa.php?id=13353>Bergantiños FC</a>, por <a href=/match.php?id=8842246>0x1</a>, no sábado. Nesta competição, o time do técnico José Ameneiro vinha de um empate, e a equipe comandada por Ezequiel Loza vinha de uma derrota.</p><p>Com o placar zerado, as equipes seguiram para o vestiário.</p><p>Aos 65 minutos, <a href=/player.php?id=1015245>Arevalo</a> marcou o único gol para o Racing Santander B.</p><p>Com o resultado, o Racing Santander B ocupa o quarto lugar na <a href=/edicao.php?id_edicao=167018> tabela</a>, com 13 pontos, enquanto o Bergantiños FC encontra-se na décima sétima posição, 5 pontos. Na próxima rodada do Segunda División RFEF, o time do técnico Ezequiel Loza <a href=/match.php?id=8842255> recebe o Gimnástica Torrelavega</a>, enquanto a equipe do técnico José Ameneiro <a href=/match.php?id=8842256> desafia o Marino fora de casa</a>.</p>","<p>Em jogo válido pela sétima rodada do <a href=/edicao.php?id_edicao=167018>Segunda División RFEF</a>, o <a href=/equipa.php?id=8470>Racing Santander B</a> bateu o <a href=/equipa.php?id=13353>Bergantiños FC</a>, por <a href=/match.php?id=8842246>0x1</a>, no sábado. Nesta competição, o time do técnico José Ameneiro vinha de um empate, e a equipe comandada por Ezequiel Loza vinha de uma derrota.</p><p>Com o placar zerado, as equipes seguiram para o vestiário.</p><p>Aos 65 minutos, <a href=/player.php?id=1015245>Arevalo</a> marcou o único gol para o Racing Santander B.</p><p>Com o resultado, o Racing Santander B ocupa o quarto lugar na <a href=/edicao.php?id_edicao=167018> tabela</a>, com 13 pontos, enquanto o Bergantiños FC encontra-se na décima sétima posição, 5 pontos. Na próxima rodada do Segunda División RFEF, o time do técnico Ezequiel Loza <a href=/match.php?id=8842255> recebe o Gimnástica Torrelavega</a>, enquanto a equipe do técnico José Ameneiro <a href=/match.php?id=8842256> desafia o Marino fora de casa</a>.</p>","1","2022-10-15 23:59:59"
"3060058","8842237","Duelo entre Laredo e Bergantiños FC não foi além de um empate","Duelo entre Laredo e Bergantiños FC não foi além de um empate","<p><a href=/equipa.php?id=8471>Laredo</a> e <a href=/equipa.php?id=13353>Bergantiños FC</a> empataram no domingo, em <a href=/match.php?id=8842237>2x2</a>, em jogo válido pela sexta rodada do <a href=/edicao.php?id_edicao=167018>Segunda División RFEF</a>. Antes desta rodada, a equipe de Laredo vinha de uma derrota, e o time treinado por José Ameneiro vinha de duas derrotas. <a href=/player.php?id=144822>Marcos Remeseiro</a> foi decisivo com 1 gol.</p><p><a href=/player.php?id=324164>Carlos López</a> inaugurou o marcador para o Bergantiños FC aos 4. <a href=/player.php?id=777392>Álvaro García</a>, empatou o jogo aos 28 minutos.</p><p>Aos 69, <a href=/player.php?id=474086>Iván Garrido</a> deixou a partida após receber o cartão vermelho. Quando o relógio marcava os 84 minutos, <a href=/player.php?id=1006589>Jon Sanmillán</a> fez o segundo gol para o Laredo. Marcos Remeseiro selou o placar final, <a href=/match.php?id=8842237>2x2</a>.</p><p>Com o resultado, o Laredo ocupa o sexto lugar na <a href=/edicao.php?id_edicao=167018> tabela</a>, com 10 pontos, enquanto o Bergantiños FC encontra-se na décima sexta posição, 5 pontos. Na sequêncida do Segunda División RFEF, a equipe do técnico Chiri <a href=/match.php?id=8842245> joga fora contra Gimnástica Torrelavega</a>, já a equipe comandada por José Ameneiro <a href=/match.php?id=8842246> joga em casa contra Racing Santander B</a>.</p>","<p><a href=/equipa.php?id=8471>Laredo</a> e <a href=/equipa.php?id=13353>Bergantiños FC</a> empataram no domingo, em <a href=/match.php?id=8842237>2x2</a>, em jogo válido pela sexta rodada do <a href=/edicao.php?id_edicao=167018>Segunda División RFEF</a>. Antes desta rodada, a equipe de Laredo vinha de uma derrota, e o time treinado por José Ameneiro vinha de duas derrotas. <a href=/player.php?id=144822>Marcos Remeseiro</a> foi decisivo com 1 gol.</p><p><a href=/player.php?id=324164>Carlos López</a> inaugurou o marcador para o Bergantiños FC aos 4. <a href=/player.php?id=777392>Álvaro García</a>, empatou o jogo aos 28 minutos.</p><p>Aos 69, <a href=/player.php?id=474086>Iván Garrido</a> deixou a partida após receber o cartão vermelho. Quando o relógio marcava os 84 minutos, <a href=/player.php?id=1006589>Jon Sanmillán</a> fez o segundo gol para o Laredo. Marcos Remeseiro selou o placar final, <a href=/match.php?id=8842237>2x2</a>.</p><p>Com o resultado, o Laredo ocupa o sexto lugar na <a href=/edicao.php?id_edicao=167018> tabela</a>, com 10 pontos, enquanto o Bergantiños FC encontra-se na décima sexta posição, 5 pontos. Na sequêncida do Segunda División RFEF, a equipe do técnico Chiri <a href=/match.php?id=8842245> joga fora contra Gimnástica Torrelavega</a>, já a equipe comandada por José Ameneiro <a href=/match.php?id=8842246> joga em casa contra Racing Santander B</a>.</p>","1","2022-10-09 23:59:59"
"3060054","8842241","Zamora derrota o Burgos Promesas 2000 por 0x1","Zamora derrota o Burgos Promesas 2000 por 0x1","<p>Na sexta rodada, o <a href=/equipa.php?id=6379>Zamora</a> superou o <a href=/equipa.php?id=54077>Burgos Promesas 2000</a>, por <a href=/match.php?id=8842241>0x1</a>, no domingo. Antes desta partida, o time treinado por Carlos Aguilera Ruiz vinha de uma derrota, e a equipe do técnico Yago Iglesias vinha de três derrotas.</p><p><a href=/player.php?id=879666>Ibán Ribeiro</a> marcou o gol que garantiu a vitória para o Zamora, quando o relógio assinalava os 26 minutos.</p><p>Com o resultado, o Zamora ocupa o décimo quinto lugar na <a href=/edicao.php?id_edicao=167018> classificação geral</a>, com 6 pontos. O Burgos Promesas 2000, por sua vez, fica na décima oitava posição, 2 pontos. Quanto à próxima rodada do <a href=/edicao.php?id_edicao=167018>Segunda División RFEF</a>, a equipe de Zamora <a href=/match.php?id=8842250> joga em casa contra Ourense CF</a>. Por sua vez, a equipe do técnico Carlos Aguilera Ruiz <a href=/match.php?id=8842249> desafia o Guijuelo fora de casa</a>.</p>","<p>Na sexta rodada, o <a href=/equipa.php?id=6379>Zamora</a> superou o <a href=/equipa.php?id=54077>Burgos Promesas 2000</a>, por <a href=/match.php?id=8842241>0x1</a>, no domingo. Antes desta partida, o time treinado por Carlos Aguilera Ruiz vinha de uma derrota, e a equipe do técnico Yago Iglesias vinha de três derrotas.</p><p><a href=/player.php?id=879666>Ibán Ribeiro</a> marcou o gol que garantiu a vitória para o Zamora, quando o relógio assinalava os 26 minutos.</p><p>Com o resultado, o Zamora ocupa o décimo quinto lugar na <a href=/edicao.php?id_edicao=167018> classificação geral</a>, com 6 pontos. O Burgos Promesas 2000, por sua vez, fica na décima oitava posição, 2 pontos. Quanto à próxima rodada do <a href=/edicao.php?id_edicao=167018>Segunda División RFEF</a>, a equipe de Zamora <a href=/match.php?id=8842250> joga em casa contra Ourense CF</a>. Por sua vez, a equipe do técnico Carlos Aguilera Ruiz <a href=/match.php?id=8842249> desafia o Guijuelo fora de casa</a>.</p>","1","2022-10-09 23:59:59"
"3060055","8842240","Empate em 0x0 no encontro entre SD Compostela e Guijuelo","Empate em 0x0 no encontro entre SD Compostela e Guijuelo","<p>A partida entre o <a href=/equipa.php?id=2559>SD Compostela</a> e o <a href=/equipa.php?id=13834>Guijuelo</a>, na sexta rodada, no domingo, terminou empatada sem gols, em <a href=/match.php?id=8842240>0x0</a>. Antes desta rodada, a equipe de Santiago de Compostela vinha de um triunfo, e curiosamente, a equipe de Guijuelo vinha também de uma vitória.</p><p>O placar não foi inaugurado nos primeiros 45 minutos de partida.</p><p>Assim como na primeira etapa, a segunda não teve gols e o jogo terminou em 0 a 0.</p><p>Com o resultado, o Guijuelo ocupa o segundo lugar na <a href=/edicao.php?id_edicao=167018> tabela</a>, com 14 pontos. O SD Compostela, por sua vez, fica na nona posição, 8 pontos. Quanto à próxima rodada do <a href=/edicao.php?id_edicao=167018>Segunda División RFEF</a>, a equipe de Santiago de Compostela <a href=/match.php?id=8842248> joga fora contra SDC Polvorín</a>, já a equipe de Guijuelo <a href=/match.php?id=8842249> joga em casa contra Burgos Promesas 2000</a>.</p>","<p>A partida entre o <a href=/equipa.php?id=2559>SD Compostela</a> e o <a href=/equipa.php?id=13834>Guijuelo</a>, na sexta rodada, no domingo, terminou empatada sem gols, em <a href=/match.php?id=8842240>0x0</a>. Antes desta rodada, a equipe de Santiago de Compostela vinha de um triunfo, e curiosamente, a equipe de Guijuelo vinha também de uma vitória.</p><p>O placar não foi inaugurado nos primeiros 45 minutos de partida.</p><p>Assim como na primeira etapa, a segunda não teve gols e o jogo terminou em 0 a 0.</p><p>Com o resultado, o Guijuelo ocupa o segundo lugar na <a href=/edicao.php?id_edicao=167018> tabela</a>, com 14 pontos. O SD Compostela, por sua vez, fica na nona posição, 8 pontos. Quanto à próxima rodada do <a href=/edicao.php?id_edicao=167018>Segunda División RFEF</a>, a equipe de Santiago de Compostela <a href=/match.php?id=8842248> joga fora contra SDC Polvorín</a>, já a equipe de Guijuelo <a href=/match.php?id=8842249> joga em casa contra Burgos Promesas 2000</a>.</p>","1","2022-10-09 23:59:59"
"3060057","8842239","Empate no encontro entre Marino e SDC Polvorín","Empate no encontro entre Marino e SDC Polvorín","<p>A partida entre o <a href=/equipa.php?id=13446>Marino</a> e o <a href=/equipa.php?id=97951>SDC Polvorín</a>, na sexta rodada, no domingo, terminou empatada sem gols, em <a href=/match.php?id=8842239>0x0</a>. Antes desta partida, a equipe do técnico Manel Menéndez vinha de uma derrota, e o time do técnico Roberto Trashorras vinha de três derrotas.</p><p>O placar não foi inaugurado nos primeiros 45 minutos de partida.</p><p>Sem o placar ser inaugurado, os times ouviram o apito final do árbitro.</p><p>Com o resultado, o Marino ocupa o quarto lugar na <a href=/edicao.php?id_edicao=167018> tabela</a>, com 11 pontos, enquanto o SDC Polvorín encontra-se na décima sétima posição, 3 pontos. Na próxima rodada do <a href=/edicao.php?id_edicao=167018>Segunda División RFEF</a>, o time treinado por Manel Menéndez <a href=/match.php?id=8842247> encara o Coruxo fora de casa.</a>, já a equipe de Lugo <a href=/match.php?id=8842248> joga em casa contra SD Compostela</a>.</p>","<p>A partida entre o <a href=/equipa.php?id=13446>Marino</a> e o <a href=/equipa.php?id=97951>SDC Polvorín</a>, na sexta rodada, no domingo, terminou empatada sem gols, em <a href=/match.php?id=8842239>0x0</a>. Antes desta partida, a equipe do técnico Manel Menéndez vinha de uma derrota, e o time do técnico Roberto Trashorras vinha de três derrotas.</p><p>O placar não foi inaugurado nos primeiros 45 minutos de partida.</p><p>Sem o placar ser inaugurado, os times ouviram o apito final do árbitro.</p><p>Com o resultado, o Marino ocupa o quarto lugar na <a href=/edicao.php?id_edicao=167018> tabela</a>, com 11 pontos, enquanto o SDC Polvorín encontra-se na décima sétima posição, 3 pontos. Na próxima rodada do <a href=/edicao.php?id_edicao=167018>Segunda División RFEF</a>, o time treinado por Manel Menéndez <a href=/match.php?id=8842247> encara o Coruxo fora de casa.</a>, já a equipe de Lugo <a href=/match.php?id=8842248> joga em casa contra SD Compostela</a>.</p>","1","2022-10-09 23:59:59"
"3060059","8842235","CD Arenteiro vence o CD Cristo Atlético por 0x1","CD Arenteiro vence o CD Cristo Atlético por 0x1","<p>Em jogo válido pela sexta rodada do <a href=/edicao.php?id_edicao=167018>Segunda División RFEF</a>, o <a href=/equipa.php?id=97815>CD Arenteiro</a> derrotou o <a href=/equipa.php?id=46489>CD Cristo Atlético</a>, por <a href=/match.php?id=8842235>0x1</a>, no domingo. Nesta competição, o time treinado por Chuchi vinha de um empate, e assim como a equipe comandada por Fran Justo, que vinha também de um empate.</p><p>Com o placar zerado, as equipes seguiram para o vestiário.</p><p>O <a href=/player.php?id=228497>Álex Fernández</a> fez o gol solitário da partida para o CD Arenteiro quando o relógio marcava os 77 minutos, depois de converter a cobrança de um pênalti.</p><p>Com o resultado, o CD Arenteiro ocupa o terceiro lugar na <a href=/edicao.php?id_edicao=167018> classificação geral</a>, com 12 pontos. O CD Cristo Atlético, por sua vez, fica na décima terceira posição, 6 pontos. Na próxima rodada do Segunda División RFEF, a equipe comandada por Fran Justo <a href=/match.php?id=8842244> joga em casa contra Valladolid B</a>. Por sua vez, o time do técnico Chuchi <a href=/match.php?id=8842243> joga fora contra Real Avilés</a>.</p>","<p>Em jogo válido pela sexta rodada do <a href=/edicao.php?id_edicao=167018>Segunda División RFEF</a>, o <a href=/equipa.php?id=97815>CD Arenteiro</a> derrotou o <a href=/equipa.php?id=46489>CD Cristo Atlético</a>, por <a href=/match.php?id=8842235>0x1</a>, no domingo. Nesta competição, o time treinado por Chuchi vinha de um empate, e assim como a equipe comandada por Fran Justo, que vinha também de um empate.</p><p>Com o placar zerado, as equipes seguiram para o vestiário.</p><p>O <a href=/player.php?id=228497>Álex Fernández</a> fez o gol solitário da partida para o CD Arenteiro quando o relógio marcava os 77 minutos, depois de converter a cobrança de um pênalti.</p><p>Com o resultado, o CD Arenteiro ocupa o terceiro lugar na <a href=/edicao.php?id_edicao=167018> classificação geral</a>, com 12 pontos. O CD Cristo Atlético, por sua vez, fica na décima terceira posição, 6 pontos. Na próxima rodada do Segunda División RFEF, a equipe comandada por Fran Justo <a href=/match.php?id=8842244> joga em casa contra Valladolid B</a>. Por sua vez, o time do técnico Chuchi <a href=/match.php?id=8842243> joga fora contra Real Avilés</a>.</p>","1","2022-10-09 23:59:59"
"3060060","8842238","Coruxo vence o Racing Santander B por 0x2","Coruxo vence o Racing Santander B por 0x2","<p>O <a href=/equipa.php?id=11719>Coruxo</a> derrotou o <a href=/equipa.php?id=8470>Racing Santander B</a> num confronto no domingo, por <a href=/match.php?id=8842238>0x2</a>, na sexta rodada. Antes desta partida, o time do técnico Ezequiel Loza vinha de um triunfo, e assim como a equipe do técnico Jacobo Montes, que vinha também de um triunfo.</p><p>Com o placar zerado, as equipes seguiram para o vestiário.</p><p><a href=/player.php?id=687966>Juan Antonini</a> inaugurou o marcador para o Coruxo no minuto 48. <a href=/player.php?id=227660>Andriu</a> decretou o placar final, aos 52 minutos.</p><p>Com o resultado, o Coruxo ocupa o quinto lugar na <a href=/edicao.php?id_edicao=167018> classificação geral</a>, com 11 pontos, enquanto o Racing Santander B encontra-se na sétima posição, 10 pontos. Na sequêncida do <a href=/edicao.php?id_edicao=167018>Segunda División RFEF</a>, a equipe comandada por Jacobo Montes <a href=/match.php?id=8842247> recebe o Marino</a>, enquanto a equipe de Santander <a href=/match.php?id=8842246> visita a casa do Bergantiños FC</a>.</p>","<p>O <a href=/equipa.php?id=11719>Coruxo</a> derrotou o <a href=/equipa.php?id=8470>Racing Santander B</a> num confronto no domingo, por <a href=/match.php?id=8842238>0x2</a>, na sexta rodada. Antes desta partida, o time do técnico Ezequiel Loza vinha de um triunfo, e assim como a equipe do técnico Jacobo Montes, que vinha também de um triunfo.</p><p>Com o placar zerado, as equipes seguiram para o vestiário.</p><p><a href=/player.php?id=687966>Juan Antonini</a> inaugurou o marcador para o Coruxo no minuto 48. <a href=/player.php?id=227660>Andriu</a> decretou o placar final, aos 52 minutos.</p><p>Com o resultado, o Coruxo ocupa o quinto lugar na <a href=/edicao.php?id_edicao=167018> classificação geral</a>, com 11 pontos, enquanto o Racing Santander B encontra-se na sétima posição, 10 pontos. Na sequêncida do <a href=/edicao.php?id_edicao=167018>Segunda División RFEF</a>, a equipe comandada por Jacobo Montes <a href=/match.php?id=8842247> recebe o Marino</a>, enquanto a equipe de Santander <a href=/match.php?id=8842246> visita a casa do Bergantiños FC</a>.</p>","1","2022-10-09 23:59:59"
"3060065","8842234","Real Avilés vence o Real Oviedo B por 4x2","Real Avilés vence o Real Oviedo B por 4x2","<p>O <a href=/equipa.php?id=23617>Real Avilés</a> superou o <a href=/equipa.php?id=8467>Real Oviedo B</a> num confronto no domingo, por <a href=/match.php?id=8842234>4x2</a>, na sexta rodada. Nesta competição, a equipe de Avilés vinha de um empate, e o time do técnico Jaime Álvarez vinha de duas derrotas.</p><p><a href=/player.php?id=453788>Primo </a> inaugurou o placar, aos 10 minutos. <a href=/player.php?id=906184>Miguel Cuesta</a>, empatou o jogo aos 27. No minuto 36, <a href=/player.php?id=149680>Jorge Fernández</a> fez o segundo gol para o Real Avilés.</p><p>Aos 57, <a href=/player.php?id=826771>Álex Suárez</a> marcou o segundo gol para o Real Oviedo B. <a href=/player.php?id=431891>Pablo Espina</a> marcou para a equipe de Avilés quando o relógio marcava os 65 minutos. <a href=/player.php?id=39389>Natalio Lorenzo</a> decretou o placar final, de pênaltiquando o relógio assinalava os 83 minutos.</p><p>Com o resultado, o Real Avilés ocupa o oitavo lugar na <a href=/edicao.php?id_edicao=167018> tabela</a>, com 8 pontos, enquanto o Real Oviedo B encontra-se na décima segunda posição, 6 pontos. Quanto à próxima rodada do <a href=/edicao.php?id_edicao=167018>Segunda División RFEF</a>, o time do técnico Emilio Cañedo <a href=/match.php?id=8842243> joga em casa contra CD Cristo Atlético</a>. Por sua vez, a equipe comandada por Jaime Álvarez <a href=/match.php?id=8842251> joga em casa contra Langreo</a>.</p>","<p>O <a href=/equipa.php?id=23617>Real Avilés</a> superou o <a href=/equipa.php?id=8467>Real Oviedo B</a> num confronto no domingo, por <a href=/match.php?id=8842234>4x2</a>, na sexta rodada. Nesta competição, a equipe de Avilés vinha de um empate, e o time do técnico Jaime Álvarez vinha de duas derrotas.</p><p><a href=/player.php?id=453788>Primo </a> inaugurou o placar, aos 10 minutos. <a href=/player.php?id=906184>Miguel Cuesta</a>, empatou o jogo aos 27. No minuto 36, <a href=/player.php?id=149680>Jorge Fernández</a> fez o segundo gol para o Real Avilés.</p><p>Aos 57, <a href=/player.php?id=826771>Álex Suárez</a> marcou o segundo gol para o Real Oviedo B. <a href=/player.php?id=431891>Pablo Espina</a> marcou para a equipe de Avilés quando o relógio marcava os 65 minutos. <a href=/player.php?id=39389>Natalio Lorenzo</a> decretou o placar final, de pênaltiquando o relógio assinalava os 83 minutos.</p><p>Com o resultado, o Real Avilés ocupa o oitavo lugar na <a href=/edicao.php?id_edicao=167018> tabela</a>, com 8 pontos, enquanto o Real Oviedo B encontra-se na décima segunda posição, 6 pontos. Quanto à próxima rodada do <a href=/edicao.php?id_edicao=167018>Segunda División RFEF</a>, o time do técnico Emilio Cañedo <a href=/match.php?id=8842243> joga em casa contra CD Cristo Atlético</a>. Por sua vez, a equipe comandada por Jaime Álvarez <a href=/match.php?id=8842251> joga em casa contra Langreo</a>.</p>","1","2022-10-09 23:59:59"
"3060061","8842242","Ourense CF vence o Langreo por 1x0","Ourense CF vence o Langreo por 1x0","<p>O <a href=/equipa.php?id=19361>Ourense CF</a> levou a melhor sobre o <a href=/equipa.php?id=26491>Langreo</a> em um encontro apertado no sábado, por <a href=/match.php?id=8842242>1x0</a>, em jogo válido pela sexta rodada do <a href=/edicao.php?id_edicao=167018>Segunda División RFEF</a>. Antes desta partida, o time treinado por Rúben Rodriguez vinha de um triunfo, e a equipe de Langreo vinha de duas vitórias.</p><p>Aos 14, <a href=/player.php?id=481427>Alberto Gil</a> marcou o único gol para o Ourense CF.</p><p>Com o resultado, o Ourense CF ocupa o décimo lugar na <a href=/edicao.php?id_edicao=167018> tabela</a>, com 8 pontos, enquanto o Langreo encontra-se na décima quarta posição, 6 pontos. Na sequêncida do Segunda División RFEF, a equipe de Orense <a href=/match.php?id=8842250> visita o Zamora</a>. Por sua vez, o time do técnico Roberto Robles <a href=/match.php?id=8842251> enfrenta o Real Oviedo B fora de casa.</a>.</p>","<p>O <a href=/equipa.php?id=19361>Ourense CF</a> levou a melhor sobre o <a href=/equipa.php?id=26491>Langreo</a> em um encontro apertado no sábado, por <a href=/match.php?id=8842242>1x0</a>, em jogo válido pela sexta rodada do <a href=/edicao.php?id_edicao=167018>Segunda División RFEF</a>. Antes desta partida, o time treinado por Rúben Rodriguez vinha de um triunfo, e a equipe de Langreo vinha de duas vitórias.</p><p>Aos 14, <a href=/player.php?id=481427>Alberto Gil</a> marcou o único gol para o Ourense CF.</p><p>Com o resultado, o Ourense CF ocupa o décimo lugar na <a href=/edicao.php?id_edicao=167018> tabela</a>, com 8 pontos, enquanto o Langreo encontra-se na décima quarta posição, 6 pontos. Na sequêncida do Segunda División RFEF, a equipe de Orense <a href=/match.php?id=8842250> visita o Zamora</a>. Por sua vez, o time do técnico Roberto Robles <a href=/match.php?id=8842251> enfrenta o Real Oviedo B fora de casa.</a>.</p>","1","2022-10-08 23:59:59"
