"id","fk_jogo","title","title","texto","large_text","te_modalidade","start_day"
"2450995","8842508","SD Tarazona se impõe diante o CD Tudelano e vence por 4x1","SD Tarazona se impõe diante o CD Tudelano e vence por 4x1","<p>O SD Tarazona bateu o CD Tudelano num confronto no domingo, por <a href=/match.php?id=8842508>4x1</a>, na 2ª rodada. Antes desta rodada, o time do técnico Javi Moreno vinha de uma derrota, e o time do técnico Oriol Riera estreava na competição. <a href=/player.php?id=778296>Marcos Mendes</a> foi destaque do jogo.</p><p>O primeiro gol do jogo foi marcado por Marcos Mendes aos 16. Em um lance de azar, <a href=/player.php?id=17199>Roberto Santamaría</a> fez um gol contra quando o relógio assinalava os 36 minutos.</p><p><a href=/player.php?id=524387>Oier Sarriegi</a> diminuiu a diferença quando o relógio assinalava os 70 minutos. O SD Tarazona ampliou a vantagem aos 74, com um gol do Marcos Mendes. Quando o relógio marcava os 89 minutos, o atacante completou três gols no jogo. Foi o terceiro gol do atacante na temporada.</p><p>Com o resultado, o SD Tarazona ocupa o quinto lugar na <a href=/edicao.php?id_edicao=167019> tabela</a>, com 3 pontos, enquanto o CD Tudelano encontra-se na décima oitava posição, 1 ponto. No próximo jogo do <a href=/edicao.php?id_edicao=167019>Segunda División RFEF</a>, a equipe do técnico Javi Moreno <a href=/match.php?id=8842516> visita a casa do Izarra</a>, enquanto a equipe do técnico Oriol Riera <a href=/match.php?id=8842517> recebe o Utebo</a>.</p>","<p>O SD Tarazona bateu o CD Tudelano num confronto no domingo, por <a href=/match.php?id=8842508>4x1</a>, na 2ª rodada. Antes desta rodada, o time do técnico Javi Moreno vinha de uma derrota, e o time do técnico Oriol Riera vinha de um empate. <a href=/player.php?id=778296>Marcos Mendes</a> foi destaque do jogo.</p><p>O primeiro gol do jogo foi marcado por Marcos Mendes aos 16. Em um lance de azar, <a href=/player.php?id=17199>Roberto Santamaría</a> fez um gol contra quando o relógio assinalava os 36 minutos.</p><p><a href=/player.php?id=524387>Oier Sarriegi</a> diminuiu a diferença quando o relógio assinalava os 70 minutos. O SD Tarazona ampliou a vantagem aos 74, com um gol do Marcos Mendes. Quando o relógio marcava os 89 minutos, o atacante completou três gols no jogo. Foi o terceiro gol do atacante na temporada.</p><p>Com o resultado, o SD Tarazona ocupa o quinto lugar na <a href=/edicao.php?id_edicao=167019> tabela</a>, com 3 pontos, enquanto o CD Tudelano encontra-se na décima oitava posição, 1 ponto. No próximo jogo do <a href=/edicao.php?id_edicao=167019>Segunda División RFEF</a>, a equipe do técnico Javi Moreno <a href=/match.php?id=8842516> visita a casa do Izarra</a>, enquanto a equipe do técnico Oriol Riera <a href=/match.php?id=8842517> recebe o Utebo</a>.</p>","1","2022-09-11 23:59:59"
"2451107","8842507","Empate em 0x0 no encontro entre Izarra e Beasain","Empate em 0x0 no encontro entre Izarra e Beasain","<p>A partida entre o Izarra e o Beasain, em jogo da 2ª rodada, no domingo, terminou empatada sem gols, em <a href=/match.php?id=8842507>0x0</a>. Antes desta rodada, a equipe de Estella estreava na competição, e a equipe de Beasain vinha de um empate.</p><p>Sem abrir o placar, as equipes foram para o vestiário.</p><p>Na etapa complementar, os times seguiram sem conseguir inaugurar o placar e o jogo não saiu do 0 a 0.</p><p>Com o resultado, o Izarra ocupa o décimo lugar na <a href=/edicao.php?id_edicao=167019> tabela</a>, com 2 pontos. O Beasain, por sua vez, fica na décima primeira posição, 2 pontos. Na próxima rodada do <a href=/edicao.php?id_edicao=167019>Segunda División RFEF</a>, a equipe comandada por Alex Huerta <a href=/match.php?id=8842516> joga em casa contra SD Tarazona</a>, já a equipe do técnico Igor Gordobil <a href=/match.php?id=8842524> joga em casa contra Mutilvera</a>.</p>","<p>A partida entre o Izarra e o Beasain, em jogo da 2ª rodada, no domingo, terminou empatada sem gols, em <a href=/match.php?id=8842507>0x0</a>. Antes desta rodada, a equipe de Estella vinha de um empate, e a equipe de Beasain vinha de um empate.</p><p>Sem abrir o placar, as equipes foram para o vestiário.</p><p>Na etapa complementar, os times seguiram sem conseguir inaugurar o placar e o jogo não saiu do 0 a 0.</p><p>Com o resultado, o Izarra ocupa o décimo lugar na <a href=/edicao.php?id_edicao=167019> tabela</a>, com 2 pontos. O Beasain, por sua vez, fica na décima primeira posição, 2 pontos. Na próxima rodada do <a href=/edicao.php?id_edicao=167019>Segunda División RFEF</a>, a equipe comandada por Alex Huerta <a href=/match.php?id=8842516> joga em casa contra SD Tarazona</a>, já a equipe do técnico Igor Gordobil <a href=/match.php?id=8842524> joga em casa contra Mutilvera</a>.</p>","1","2022-09-11 23:59:59"
"2451175","8842509","Sestao River derrota o Utebo por 0x1","Sestao River derrota o Utebo por 0x1","<p>O Sestao River venceu o Utebo num duelo apertado no domingo, por <a href=/match.php?id=8842509>0x1</a>, em jogo da 2ª rodada. Antes desta rodada, a equipe comandada por Juan Carlos Beltrán vinha de um empate, e a equipe de Sastao - Bizkaia vinha de um triunfo.</p><p>O primeiro tempo chegou ao fim sem gols.</p><p>A entrada de <a href=/player.php?id=143892>Goti</a>, aos 67, mudou os rumos do jogo. O atacante fez o gol solitário da partida para o Sestao River aos 71 minutos.</p><p>Com o resultado, o Sestao River ocupa o terceiro lugar na <a href=/edicao.php?id_edicao=167019> tabela</a>, com 6 pontos, enquanto o Utebo encontra-se na décima quarta posição, 1 ponto. Na sequêncida do <a href=/edicao.php?id_edicao=167019>Segunda División RFEF</a>, a equipe de Sastao - Bizkaia <a href=/match.php?id=8842518> recebe o Alfaro</a>, já a equipe do técnico Juan Carlos Beltrán <a href=/match.php?id=8842517> enfrenta o CD Tudelano fora de casa.</a>.</p>","<p>O Sestao River venceu o Utebo num duelo apertado no domingo, por <a href=/match.php?id=8842509>0x1</a>, em jogo da 2ª rodada. Antes desta rodada, a equipe comandada por Juan Carlos Beltrán vinha de um empate, e a equipe de Sastao - Bizkaia vinha de um triunfo.</p><p>O primeiro tempo chegou ao fim sem gols.</p><p>A entrada de <a href=/player.php?id=143892>Goti</a>, aos 67, mudou os rumos do jogo. O atacante fez o gol solitário da partida para o Sestao River aos 71 minutos.</p><p>Com o resultado, o Sestao River ocupa o terceiro lugar na <a href=/edicao.php?id_edicao=167019> tabela</a>, com 6 pontos, enquanto o Utebo encontra-se na décima quarta posição, 1 ponto. Na sequêncida do <a href=/edicao.php?id_edicao=167019>Segunda División RFEF</a>, a equipe de Sastao - Bizkaia <a href=/match.php?id=8842518> recebe o Alfaro</a>, já a equipe do técnico Juan Carlos Beltrán <a href=/match.php?id=8842517> enfrenta o CD Tudelano fora de casa.</a>.</p>","1","2022-09-11 23:59:59"
"2451281","8842512","Arenas Club se impõe diante o CD Arnedo e vence por 4x1","Arenas Club se impõe diante o CD Arnedo e vence por 4x1","<p>Em jogo da 2ª rodada, o Arenas Club derrotou o CD Arnedo, por <a href=/match.php?id=8842512>4x1</a>, no domingo. Antes desta rodada, a equipe de Getxo - Vizcaya vinha de um triunfo, e curiosamente, a equipe de Arnedo (La Rioja) vinha também de uma vitória.</p><p><a href=/player.php?id=1020903>Iñigo López</a> fez o primeiro gol da partida, quando o relógio marcava os 25 minutos. Aos 34, o Arenas Club aumentou o placar, com gol de <a href=/player.php?id=831093>Markel Goñi</a>.</p><p><a href=/player.php?id=429353>Raúl Almagro</a> diminuiu a diferença quando o relógio assinalava os 50 minutos. <a href=/player.php?id=831096>Unai García</a> ampliou a vantagem aos 67 minutos. No minuto 73, o defensor fechou o placar.</p><p>Com o resultado, o Arenas Club ocupa o primeiro lugar na <a href=/edicao.php?id_edicao=167019> tabela</a>, com 6 pontos. O CD Arnedo, por sua vez, fica na sexta posição, 3 pontos. Na próxima rodada do <a href=/edicao.php?id_edicao=167019>Segunda División RFEF</a>, a equipe de Getxo - Vizcaya <a href=/match.php?id=8842520> joga fora contra Racing Rioja</a>, já a equipe de Arnedo (La Rioja) <a href=/match.php?id=8842521> joga em casa contra Gernika</a>.</p>","<p>Em jogo da 2ª rodada, o Arenas Club derrotou o CD Arnedo, por <a href=/match.php?id=8842512>4x1</a>, no domingo. Antes desta rodada, a equipe de Getxo - Vizcaya vinha de um triunfo, e curiosamente, a equipe de Arnedo (La Rioja) vinha também de uma vitória.</p><p><a href=/player.php?id=1020903>Iñigo López</a> fez o primeiro gol da partida, quando o relógio marcava os 25 minutos. Aos 34, o Arenas Club aumentou o placar, com gol de <a href=/player.php?id=831093>Markel Goñi</a>.</p><p><a href=/player.php?id=429353>Raúl Almagro</a> diminuiu a diferença quando o relógio assinalava os 50 minutos. <a href=/player.php?id=831096>Unai García</a> ampliou a vantagem aos 67 minutos. No minuto 73, o defensor fechou o placar.</p><p>Com o resultado, o Arenas Club ocupa o primeiro lugar na <a href=/edicao.php?id_edicao=167019> tabela</a>, com 6 pontos. O CD Arnedo, por sua vez, fica na sexta posição, 3 pontos. Na próxima rodada do <a href=/edicao.php?id_edicao=167019>Segunda División RFEF</a>, a equipe de Getxo - Vizcaya <a href=/match.php?id=8842520> joga fora contra Racing Rioja</a>, já a equipe de Arnedo (La Rioja) <a href=/match.php?id=8842521> joga em casa contra Gernika</a>.</p>","1","2022-09-11 23:59:59"
"2451399","8842514","Duelo entre Alavés B e CA Cirbonero não foi além de um empate","Duelo entre Alavés B e CA Cirbonero não foi além de um empate","<p>Alavés B e CA Cirbonero empataram sem gols no domingo, em <a href=/match.php?id=8842514>0x0</a>, na 2ª rodada. Antes desta partida, o time do técnico José Manuel Aira vinha de uma derrota, e o time do técnico Xabi Mata vinha de um empate.</p><p>Sem abrir o placar, as equipes foram para o vestiário.</p><p><a href=/player.php?id=775602>Lucas Moura</a> entrou em campo aos 46 minutos.</p><p>Assim como na primeira etapa, a segunda não teve gols e o jogo terminou em 0 a 0.</p><p>Com o resultado, o CA Cirbonero ocupa o nono lugar na <a href=/edicao.php?id_edicao=167019> tabela</a>, com 2 pontos. O Alavés B, por sua vez, fica na décima sétima posição, 1 ponto. Quanto à próxima rodada do <a href=/edicao.php?id_edicao=167019>Segunda División RFEF</a>, a equipe comandada por José Manuel Aira <a href=/match.php?id=8842522> encara o CD Brea fora de casa.</a>, já a equipe comandada por Xabi Mata <a href=/match.php?id=8842523> recebe o AD San Juan</a>.</p>","<p>Alavés B e CA Cirbonero empataram sem gols no domingo, em <a href=/match.php?id=8842514>0x0</a>, na 2ª rodada. Antes desta partida, o time do técnico José Manuel Aira vinha de uma derrota, e o time do técnico Xabi Mata vinha de um empate.</p><p>Sem abrir o placar, as equipes foram para o vestiário.</p><p><a href=/player.php?id=775602>Lucas Moura</a> entrou em campo aos 46 minutos.</p><p>Assim como na primeira etapa, a segunda não teve gols e o jogo terminou em 0 a 0.</p><p>Com o resultado, o CA Cirbonero ocupa o nono lugar na <a href=/edicao.php?id_edicao=167019> tabela</a>, com 2 pontos. O Alavés B, por sua vez, fica na décima sétima posição, 1 ponto. Quanto à próxima rodada do <a href=/edicao.php?id_edicao=167019>Segunda División RFEF</a>, a equipe comandada por José Manuel Aira <a href=/match.php?id=8842522> encara o CD Brea fora de casa.</a>, já a equipe comandada por Xabi Mata <a href=/match.php?id=8842523> recebe o AD San Juan</a>.</p>","1","2022-09-11 23:59:59"
"2452655","8842510","Alfaro derrota a Real Sociedad C por 3x1","Alfaro derrota a Real Sociedad C por 3x1","<p>O Alfaro derrotou a Real Sociedad C num confronto no sábado, por <a href=/match.php?id=8842510>3x1</a>, na 2ª rodada. Antes desta rodada, a equipe de Alfaro vinha de um empate, e assim como a equipe de San Sebastián, que vinha também de um empate.</p><p>Aos 20, <a href=/player.php?id=1022552>Arturo Fernández</a> abriu o placar para o Alfaro. No minuto 26, a equipe de Alfaro aumentou o placar, com gol de <a href=/player.php?id=1022555>Albin</a>.</p><p><a href=/player.php?id=835603>Aimar González</a> diminuiu a diferença aos 62 minutos. <a href=/player.php?id=1022554>Alex Aguado</a> selou o placar final, <a href=/match.php?id=8842510>3x1</a>.</p><p>Com o resultado, o Alfaro ocupa o quarto lugar na <a href=/edicao.php?id_edicao=167019> tabela</a>, com 4 pontos, enquanto a Real Sociedad C encontra-se na décima sexta posição, 1 ponto. Na sequêncida do <a href=/edicao.php?id_edicao=167019>Segunda División RFEF</a>, a equipe do técnico Israel Villarreal <a href=/match.php?id=8842518> visita a casa do Sestao River</a>. Por sua vez, a equipe comandada por Mikel Llorente <a href=/match.php?id=8842519> recebe o UD Logroñés B</a>.</p>","<p>O Alfaro derrotou a Real Sociedad C num confronto no sábado, por <a href=/match.php?id=8842510>3x1</a>, na 2ª rodada. Antes desta rodada, a equipe de Alfaro vinha de um empate, e assim como a equipe de San Sebastián, que vinha também de um empate.</p><p>Aos 20, <a href=/player.php?id=1022552>Arturo Fernández</a> abriu o placar para o Alfaro. No minuto 26, a equipe de Alfaro aumentou o placar, com gol de <a href=/player.php?id=1022555>Albin</a>.</p><p><a href=/player.php?id=835603>Aimar González</a> diminuiu a diferença aos 62 minutos. <a href=/player.php?id=1022554>Alex Aguado</a> selou o placar final, <a href=/match.php?id=8842510>3x1</a>.</p><p>Com o resultado, o Alfaro ocupa o quarto lugar na <a href=/edicao.php?id_edicao=167019> tabela</a>, com 4 pontos, enquanto a Real Sociedad C encontra-se na décima sexta posição, 1 ponto. Na sequêncida do <a href=/edicao.php?id_edicao=167019>Segunda División RFEF</a>, a equipe do técnico Israel Villarreal <a href=/match.php?id=8842518> visita a casa do Sestao River</a>. Por sua vez, a equipe comandada por Mikel Llorente <a href=/match.php?id=8842519> recebe o UD Logroñés B</a>.</p>","1","2022-09-10 23:59:59"
"2452808","8842511","UD Logroñés B supera o Racing Rioja por 1x0","UD Logroñés B supera o Racing Rioja por 1x0","<p>O UD Logroñés B bateu o Racing Rioja num confronto apertado no sábado, por <a href=/match.php?id=8842511>1x0</a>, em jogo da 2ª rodada. Antes desta rodada, a equipe de Logroño vinha de uma derrota, e a equipe de Logrono vinha de um empate.</p><p>A etapa inicial terminou em 0 a 0.</p><p>A entrada de <a href=/player.php?id=937620>Villoslada</a>, aos 75, foi decisiva no jogo. O atacante fez o gol solitário da partida para o UD Logroñés B nos acréscimos.</p><p>Com o resultado, o UD Logroñés B ocupa o sétimo lugar na <a href=/edicao.php?id_edicao=167019> tabela</a>, com 3 pontos, enquanto o Racing Rioja encontra-se na décima terceira posição, 1 ponto. Quanto à próxima rodada do <a href=/edicao.php?id_edicao=167019>Segunda División RFEF</a>, a equipe de Logroño <a href=/match.php?id=8842519> visita a Real Sociedad C</a>, já a equipe de Logrono <a href=/match.php?id=8842520> joga em casa contra Arenas Club</a>.</p>","<p>O UD Logroñés B bateu o Racing Rioja num confronto apertado no sábado, por <a href=/match.php?id=8842511>1x0</a>, em jogo da 2ª rodada. Antes desta rodada, a equipe de Logroño vinha de uma derrota, e a equipe de Logrono vinha de um empate.</p><p>A etapa inicial terminou em 0 a 0.</p><p>A entrada de <a href=/player.php?id=937620>Villoslada</a>, aos 75, foi decisiva no jogo. O atacante fez o gol solitário da partida para o UD Logroñés B nos acréscimos.</p><p>Com o resultado, o UD Logroñés B ocupa o sétimo lugar na <a href=/edicao.php?id_edicao=167019> tabela</a>, com 3 pontos, enquanto o Racing Rioja encontra-se na décima terceira posição, 1 ponto. Quanto à próxima rodada do <a href=/edicao.php?id_edicao=167019>Segunda División RFEF</a>, a equipe de Logroño <a href=/match.php?id=8842519> visita a Real Sociedad C</a>, já a equipe de Logrono <a href=/match.php?id=8842520> joga em casa contra Arenas Club</a>.</p>","1","2022-09-10 23:59:59"
"2208328","8842195","Racing Santander B vence o Ourense CF por 1x2","Racing Santander B vence o Ourense CF por 1x2","<p>O Racing Santander B levou a melhor sobre o Ourense CF em um encontro apertado no domingo, por <a href=/match.php?id=8842195>1x2</a>, em jogo da 1ª rodada. A equipe de Orense e a equipe de Santander estrearam na competição.</p><p>Aos 11, <a href=/player.php?id=695154>Dali</a> abriu o placar para o Racing Santander B, de pênalti.</p><p>O time treinado por Ezequiel Loza ampliou a vantagem na volta do intervalo, com um gol do <a href=/player.php?id=1007844>Mario García</a>. <a href=/player.php?id=454581>Borja Domingo</a> decretou o placar final, no minuto 64. Aos 84, Dali foi substituído.</p><p>Com o resultado, o Racing Santander B ocupa o primeiro lugar na <a href=/edicao.php?id_edicao=167018> tabela</a>, com 3 pontos, enquanto o Ourense CF encontra-se na décima sexta posição, 0 pontos. Na próxima rodada do <a href=/edicao.php?id_edicao=167018>Segunda División RFEF</a>, a equipe de Santander <a href=/match.php?id=8842204> recebe o Langreo</a>. Por sua vez, a equipe de Orense <a href=/match.php?id=8842205> encara o Marino fora de casa.</a>.</p>","<p>O Racing Santander B levou a melhor sobre o Ourense CF em um encontro apertado no domingo, por <a href=/match.php?id=8842195>1x2</a>, em jogo da 1ª rodada. A equipe de Orense e a equipe de Santander estrearam na competição.</p><p>Aos 11, <a href=/player.php?id=695154>Dali</a> abriu o placar para o Racing Santander B, de pênalti.</p><p>O time treinado por Ezequiel Loza ampliou a vantagem na volta do intervalo, com um gol do <a href=/player.php?id=1007844>Mario García</a>. <a href=/player.php?id=454581>Borja Domingo</a> decretou o placar final, no minuto 64. Aos 84, Dali foi substituído.</p><p>Com o resultado, o Racing Santander B ocupa o primeiro lugar na <a href=/edicao.php?id_edicao=167018> tabela</a>, com 3 pontos, enquanto o Ourense CF encontra-se na décima sexta posição, 0 pontos. Na próxima rodada do <a href=/edicao.php?id_edicao=167018>Segunda División RFEF</a>, a equipe de Santander <a href=/match.php?id=8842204> recebe o Langreo</a>. Por sua vez, a equipe de Orense <a href=/match.php?id=8842205> encara o Marino fora de casa.</a>.</p>","1","2022-09-10 18:23:18"
"2189903","8842194","Laredo derrota o Langreo por 1x2","Laredo derrota o Langreo por 1x2","<p>O Laredo levou a melhor sobre o Langreo num duelo equilibrado no domingo, por <a href=/match.php?id=8842194>1x2</a>, em jogo válido pela 1ª rodada do <a href=/edicao.php?id_edicao=167018>Segunda División RFEF</a>. Antes desta rodada, o time treinado por Roberto Robles vinha de uma derrota, e o time do técnico Chiri estreava na competição.</p><p>O placar da partida foi inaugurado por <a href=/player.php?id=1006591>Alejandro Cañizo</a> aos 18 minutos.</p><p>No minuto 70, <a href=/player.php?id=654439>Xabier Naveira</a> marcou o segundo gol para o Laredo. <a href=/player.php?id=844736>Arzalluz</a> selou o placar final, <a href=/match.php?id=8842194>1x2</a>.</p><p>Com o resultado, o Laredo ocupa o terceiro lugar na <a href=/edicao.php?id_edicao=167018> tabela</a>, com 3 pontos, enquanto o Langreo encontra-se na décima sétima posição, 0 pontos. Na próxima rodada do Segunda División RFEF, a equipe de Laredo <a href=/match.php?id=8842203> joga em casa contra Zamora</a>. Por sua vez, a equipe de Langreo <a href=/match.php?id=8842204> enfrenta o Racing Santander B fora de casa.</a>.</p>","<p>O Laredo levou a melhor sobre o Langreo num duelo equilibrado no domingo, por <a href=/match.php?id=8842194>1x2</a>, em jogo válido pela 1ª rodada do <a href=/edicao.php?id_edicao=167018>Segunda División RFEF</a>. Antes desta rodada, o time treinado por Roberto Robles vinha de uma derrota, e o time do técnico Chiri estreava na competição.</p><p>O placar da partida foi inaugurado por <a href=/player.php?id=1006591>Alejandro Cañizo</a> aos 18 minutos.</p><p>No minuto 70, <a href=/player.php?id=654439>Xabier Naveira</a> marcou o segundo gol para o Laredo. <a href=/player.php?id=844736>Arzalluz</a> selou o placar final, <a href=/match.php?id=8842194>1x2</a>.</p><p>Com o resultado, o Laredo ocupa o terceiro lugar na <a href=/edicao.php?id_edicao=167018> tabela</a>, com 3 pontos, enquanto o Langreo encontra-se na décima sétima posição, 0 pontos. Na próxima rodada do Segunda División RFEF, a equipe de Laredo <a href=/match.php?id=8842203> joga em casa contra Zamora</a>. Por sua vez, a equipe de Langreo <a href=/match.php?id=8842204> enfrenta o Racing Santander B fora de casa.</a>.</p>","1","2022-09-08 23:35:55"
"2189781","8842191","Empate no encontro entre SDC Polvorín e Real Avilés","Empate no encontro entre SDC Polvorín e Real Avilés","<p>SDC Polvorín e Real Avilés empataram sem gols no sábado, em <a href=/match.php?id=8842191>0x0</a>, em jogo válido pela 1ª rodada do <a href=/edicao.php?id_edicao=167018>Segunda División RFEF</a>. Antes desta partida, o time do técnico Roberto Trashorras realizava o seu primeiro jogo na competição, e o time do técnico Emilio Cañedo vinha de um empate. João Costa não saiu do banco.</p><p>O primeiro tempo chegou ao fim sem gols.</p><p>Aos 61 minutos, <a href=/player.php?id=1007853>Vinicius Amorin</a> entrou no jogo.</p><p>Apesar da tentativa de ambas equipes, o 0 a 0 insistiu em permanecer no placar até o fim do jogo.</p><p>Com o resultado, o Real Avilés ocupa o sétimo lugar na <a href=/edicao.php?id_edicao=167018> classificação geral</a>, com 1 ponto, enquanto o SDC Polvorín encontra-se na décima primeira posição, 1 ponto. No próximo jogo do Segunda División RFEF, o time treinado por Roberto Trashorras <a href=/match.php?id=8842201> joga fora contra CD Cristo Atlético</a>, enquanto o time treinado por Emilio Cañedo <a href=/match.php?id=8842200> joga em casa contra Coruxo</a>.</p>","<p>SDC Polvorín e Real Avilés empataram sem gols no sábado, em <a href=/match.php?id=8842191>0x0</a>, em jogo válido pela 1ª rodada do <a href=/edicao.php?id_edicao=167018>Segunda División RFEF</a>. Antes desta partida, o time do técnico Roberto Trashorras realizava o seu primeiro jogo na competição, e o time do técnico Emilio Cañedo vinha de um empate. João Costa não saiu do banco.</p><p>O primeiro tempo chegou ao fim sem gols.</p><p>Aos 61 minutos, <a href=/player.php?id=1007853>Vinicius Amorin</a> entrou no jogo.</p><p>Apesar da tentativa de ambas equipes, o 0 a 0 insistiu em permanecer no placar até o fim do jogo.</p><p>Com o resultado, o Real Avilés ocupa o sétimo lugar na <a href=/edicao.php?id_edicao=167018> classificação geral</a>, com 1 ponto, enquanto o SDC Polvorín encontra-se na décima primeira posição, 1 ponto. No próximo jogo do Segunda División RFEF, o time treinado por Roberto Trashorras <a href=/match.php?id=8842201> joga fora contra CD Cristo Atlético</a>, enquanto o time treinado por Emilio Cañedo <a href=/match.php?id=8842200> joga em casa contra Coruxo</a>.</p>","1","2022-09-08 23:20:07"
"2189769","8842192","Guijuelo consegue vitória magra sobre o CD Cristo Atlético","Guijuelo consegue vitória magra sobre o CD Cristo Atlético","<p>Na 1ª rodada, o Guijuelo venceu o CD Cristo Atlético, por <a href=/match.php?id=8842192>1x0</a>, no domingo. Nesta competição, a equipe de Guijuelo realizava o seu primeiro jogo na competição, e a equipe de Palencia vinha de um empate.</p><p>Com o placar zerado, as equipes seguiram para o vestiário.</p><p><a href=/player.php?id=57993>Toti García</a> marcou o gol que garantiu a vitória para o Guijuelo, aos 70 minutos.</p><p>Com o resultado, o Guijuelo ocupa o quinto lugar na <a href=/edicao.php?id_edicao=167018> classificação geral</a>, com 3 pontos. O CD Cristo Atlético, por sua vez, fica na décima oitava posição, 0 pontos. Na sequêncida do <a href=/edicao.php?id_edicao=167018>Segunda División RFEF</a>, a equipe de Guijuelo <a href=/match.php?id=8842202> enfrenta o Valladolid B fora de casa.</a>, já a equipe de Palencia <a href=/match.php?id=8842201> joga em casa contra SDC Polvorín</a>.</p>","<p>Na 1ª rodada, o Guijuelo venceu o CD Cristo Atlético, por <a href=/match.php?id=8842192>1x0</a>, no domingo. Nesta competição, a equipe de Guijuelo realizava o seu primeiro jogo na competição, e a equipe de Palencia vinha de um empate.</p><p>Com o placar zerado, as equipes seguiram para o vestiário.</p><p><a href=/player.php?id=57993>Toti García</a> marcou o gol que garantiu a vitória para o Guijuelo, aos 70 minutos.</p><p>Com o resultado, o Guijuelo ocupa o quinto lugar na <a href=/edicao.php?id_edicao=167018> classificação geral</a>, com 3 pontos. O CD Cristo Atlético, por sua vez, fica na décima oitava posição, 0 pontos. Na sequêncida do <a href=/edicao.php?id_edicao=167018>Segunda División RFEF</a>, a equipe de Guijuelo <a href=/match.php?id=8842202> enfrenta o Valladolid B fora de casa.</a>, já a equipe de Palencia <a href=/match.php?id=8842201> joga em casa contra SDC Polvorín</a>.</p>","1","2022-09-08 23:19:18"
