"id","fk_jogo","title","title","texto","large_text","te_modalidade","start_day"
"3066319","8842287","Real Oviedo B supera o Guijuelo por 2x1","Real Oviedo B supera o Guijuelo por 2x1","<p>Na décima primeira rodada, o <a href=/equipa.php?id=8467>Real Oviedo B</a> bateu o <a href=/equipa.php?id=13834>Guijuelo</a>, por <a href=/match.php?id=8842287>2x1</a>, no domingo. Nesta competição, o time treinado por Jaime Álvarez vinha de três derrotas, e o time do técnico Mario Sánchez vinha de uma derrota. <a href=/player.php?id=906184>Miguel Cuesta</a> foi o grande nome do jogo.</p><p>Miguel Cuesta fez o primeiro gol da partida, quando o relógio assinalava os 29 minutos.</p><p>O Real Oviedo B ampliou a vantagem quando o relógio marcava os 48 minutos, com um gol do atacante. Aos 69 minutos, <a href=/player.php?id=57993>Toti García</a> desperdiçou pênalti. <a href=/player.php?id=567133>Álex Caramelo </a> decretou o placar final, já próximo do fim do jogo.</p><p>Com o resultado, o Guijuelo ocupa o segundo lugar na <a href=/edicao.php?id_edicao=167018> tabela</a>, com 20 pontos. O Real Oviedo B, por sua vez, fica na décima sexta posição, 10 pontos. Na sequêncida do <a href=/edicao.php?id_edicao=167018>Segunda División RFEF</a>, a equipe do técnico Jaime Álvarez <a href=/match.php?id=8842288> visita a casa do Laredo</a>, já o time do técnico Mario Sánchez <a href=/match.php?id=8842296> joga em casa contra SDC Polvorín</a>.</p>","<p>Na décima primeira rodada, o <a href=/equipa.php?id=8467>Real Oviedo B</a> bateu o <a href=/equipa.php?id=13834>Guijuelo</a>, por <a href=/match.php?id=8842287>2x1</a>, no domingo. Nesta competição, o time treinado por Jaime Álvarez vinha de três derrotas, e o time do técnico Mario Sánchez vinha de uma derrota. <a href=/player.php?id=906184>Miguel Cuesta</a> foi o grande nome do jogo.</p><p>Miguel Cuesta fez o primeiro gol da partida, quando o relógio assinalava os 29 minutos.</p><p>O Real Oviedo B ampliou a vantagem quando o relógio marcava os 48 minutos, com um gol do atacante. Aos 69 minutos, <a href=/player.php?id=57993>Toti García</a> desperdiçou pênalti. <a href=/player.php?id=567133>Álex Caramelo </a> decretou o placar final, já próximo do fim do jogo.</p><p>Com o resultado, o Guijuelo ocupa o segundo lugar na <a href=/edicao.php?id_edicao=167018> tabela</a>, com 20 pontos. O Real Oviedo B, por sua vez, fica na décima sexta posição, 10 pontos. Na sequêncida do <a href=/edicao.php?id_edicao=167018>Segunda División RFEF</a>, a equipe do técnico Jaime Álvarez <a href=/match.php?id=8842288> visita a casa do Laredo</a>, já o time do técnico Mario Sánchez <a href=/match.php?id=8842296> joga em casa contra SDC Polvorín</a>.</p>","1","2022-11-20 23:59:59"
"3069290","8842281","Real Avilés derrota o Marino por 1x0","Real Avilés derrota o Marino por 1x0","<p>O <a href=/equipa.php?id=23617>Real Avilés</a> superou o <a href=/equipa.php?id=13446>Marino</a> num confronto equilibrado no domingo, por <a href=/match.php?id=8842281>1x0</a>, em jogo da décima primeira rodada. Antes desta rodada, o time treinado por Emilio Cañedo vinha de uma derrota, e curiosamente, a equipe do técnico Manel Menéndez vinha também de uma derrota.</p><p>Quando o relógio marcava os 20 minutos, <a href=/player.php?id=453788>Primo </a> marcou o único gol para o Real Avilés.</p><p>Quando o relógio assinalava os 75 minutos, <a href=/player.php?id=331728>Nacho Matador</a> assumiu a responsabilidade da cobrança, mas perdeu o pênalti.</p><p>Com o resultado, o Real Avilés ocupa o quarto lugar na <a href=/edicao.php?id_edicao=167018> classificação geral</a>, com 18 pontos, enquanto o Marino encontra-se na décima primeira posição, 15 pontos. Na sequêncida do <a href=/edicao.php?id_edicao=167018>Segunda División RFEF</a>, o time treinado por Emilio Cañedo <a href=/match.php?id=8842291> visita o SD Compostela</a>. Por sua vez, o time do técnico Manel Menéndez <a href=/match.php?id=8842290> joga em casa contra CD Cristo Atlético</a>.</p>","<p>O <a href=/equipa.php?id=23617>Real Avilés</a> superou o <a href=/equipa.php?id=13446>Marino</a> num confronto equilibrado no domingo, por <a href=/match.php?id=8842281>1x0</a>, em jogo da décima primeira rodada. Antes desta rodada, o time treinado por Emilio Cañedo vinha de uma derrota, e curiosamente, a equipe do técnico Manel Menéndez vinha também de uma derrota.</p><p>Quando o relógio marcava os 20 minutos, <a href=/player.php?id=453788>Primo </a> marcou o único gol para o Real Avilés.</p><p>Quando o relógio assinalava os 75 minutos, <a href=/player.php?id=331728>Nacho Matador</a> assumiu a responsabilidade da cobrança, mas perdeu o pênalti.</p><p>Com o resultado, o Real Avilés ocupa o quarto lugar na <a href=/edicao.php?id_edicao=167018> classificação geral</a>, com 18 pontos, enquanto o Marino encontra-se na décima primeira posição, 15 pontos. Na sequêncida do <a href=/edicao.php?id_edicao=167018>Segunda División RFEF</a>, o time treinado por Emilio Cañedo <a href=/match.php?id=8842291> visita o SD Compostela</a>. Por sua vez, o time do técnico Manel Menéndez <a href=/match.php?id=8842290> joga em casa contra CD Cristo Atlético</a>.</p>","1","2022-11-20 23:59:59"
"3069289","8842283","Gimnástica Torrelavega consegue vitória magra sobre o Burgos Promesas 2000","Gimnástica Torrelavega consegue vitória magra sobre o Burgos Promesas 2000","<p>O <a href=/equipa.php?id=8443>Gimnástica Torrelavega</a> venceu o <a href=/equipa.php?id=54077>Burgos Promesas 2000</a> num confronto apertado no domingo, por <a href=/match.php?id=8842283>1x0</a>, em jogo da décima primeira rodada. Antes desta rodada, a equipe do técnico Sesi vinha de duas derrotas, e o time treinado por Carlos Aguilera Ruiz vinha de uma derrota.</p><p>O <a href=/player.php?id=502746>Alberto Gómez </a> fez o gol solitário da partida para o Gimnástica Torrelavega aos 34 minutos.</p><p>Com o resultado, o Gimnástica Torrelavega ocupa o décimo lugar na <a href=/edicao.php?id_edicao=167018> tabela</a>, com 16 pontos, enquanto o Burgos Promesas 2000 encontra-se na décima oitava posição, 8 pontos. Quanto à próxima rodada do <a href=/edicao.php?id_edicao=167018>Segunda División RFEF</a>, a equipe do técnico Sesi <a href=/match.php?id=8842293> visita o Ourense CF</a>, enquanto a equipe do técnico Carlos Aguilera Ruiz <a href=/match.php?id=8842292> joga em casa contra CD Arenteiro</a>.</p>","<p>O <a href=/equipa.php?id=8443>Gimnástica Torrelavega</a> venceu o <a href=/equipa.php?id=54077>Burgos Promesas 2000</a> num confronto apertado no domingo, por <a href=/match.php?id=8842283>1x0</a>, em jogo da décima primeira rodada. Antes desta rodada, a equipe do técnico Sesi vinha de duas derrotas, e o time treinado por Carlos Aguilera Ruiz vinha de uma derrota.</p><p>O <a href=/player.php?id=502746>Alberto Gómez </a> fez o gol solitário da partida para o Gimnástica Torrelavega aos 34 minutos.</p><p>Com o resultado, o Gimnástica Torrelavega ocupa o décimo lugar na <a href=/edicao.php?id_edicao=167018> tabela</a>, com 16 pontos, enquanto o Burgos Promesas 2000 encontra-se na décima oitava posição, 8 pontos. Quanto à próxima rodada do <a href=/edicao.php?id_edicao=167018>Segunda División RFEF</a>, a equipe do técnico Sesi <a href=/match.php?id=8842293> visita o Ourense CF</a>, enquanto a equipe do técnico Carlos Aguilera Ruiz <a href=/match.php?id=8842292> joga em casa contra CD Arenteiro</a>.</p>","1","2022-11-20 23:59:59"
"3069286","8842282","SD Compostela supera o CD Arenteiro por 0x1","SD Compostela supera o CD Arenteiro por 0x1","<p>Em jogo da décima primeira rodada, o <a href=/equipa.php?id=2559>SD Compostela</a> derrotou o <a href=/equipa.php?id=97815>CD Arenteiro</a>, por <a href=/match.php?id=8842282>0x1</a>, no domingo. Nesta competição, a equipe de O Carballiño vinha de cinco vitórias, e o time do técnico Fabiano Soares vinha de dois vitórias.</p><p>O <a href=/player.php?id=409521>Mario Rodríguez</a> fez o gol solitário da partida para o SD Compostela quando o relógio assinalava os 28 minutos, depois de converter a cobrança de um pênalti.</p><p>No apagar das luzes, <a href=/player.php?id=440555>Diego García</a> foi expulso ao ver o cartão vermelho.</p><p>Com o resultado, o CD Arenteiro ocupa o primeiro lugar na <a href=/edicao.php?id_edicao=167018> tabela</a>, com 24 pontos. O SD Compostela, por sua vez, fica na quinta posição, 18 pontos. No próximo jogo do <a href=/edicao.php?id_edicao=167018>Segunda División RFEF</a>, a equipe de Santiago de Compostela <a href=/match.php?id=8842291> joga em casa contra Real Avilés</a>, já a equipe de O Carballiño <a href=/match.php?id=8842292> encara o Burgos Promesas 2000 fora de casa.</a>.</p>","<p>Em jogo da décima primeira rodada, o <a href=/equipa.php?id=2559>SD Compostela</a> derrotou o <a href=/equipa.php?id=97815>CD Arenteiro</a>, por <a href=/match.php?id=8842282>0x1</a>, no domingo. Nesta competição, a equipe de O Carballiño vinha de cinco vitórias, e o time do técnico Fabiano Soares vinha de dois vitórias.</p><p>O <a href=/player.php?id=409521>Mario Rodríguez</a> fez o gol solitário da partida para o SD Compostela quando o relógio assinalava os 28 minutos, depois de converter a cobrança de um pênalti.</p><p>No apagar das luzes, <a href=/player.php?id=440555>Diego García</a> foi expulso ao ver o cartão vermelho.</p><p>Com o resultado, o CD Arenteiro ocupa o primeiro lugar na <a href=/edicao.php?id_edicao=167018> tabela</a>, com 24 pontos. O SD Compostela, por sua vez, fica na quinta posição, 18 pontos. No próximo jogo do <a href=/edicao.php?id_edicao=167018>Segunda División RFEF</a>, a equipe de Santiago de Compostela <a href=/match.php?id=8842291> joga em casa contra Real Avilés</a>, já a equipe de O Carballiño <a href=/match.php?id=8842292> encara o Burgos Promesas 2000 fora de casa.</a>.</p>","1","2022-11-20 23:59:59"
"3069287","8842285","Langreo vence o Coruxo por 0x1","Langreo vence o Coruxo por 0x1","<p>Na décima primeira rodada, o <a href=/equipa.php?id=26491>Langreo</a> bateu o <a href=/equipa.php?id=11719>Coruxo</a>, por <a href=/match.php?id=8842285>0x1</a>, no domingo. Antes desta rodada, a equipe de Coruxo - Vigo vinha de uma vitória, e a equipe comandada por Roberto Robles vinha de duas derrotas.</p><p><a href=/player.php?id=663321>Óscar Poveda </a> marcou o gol que garantiu a vitória para o Langreo, quando o relógio assinalava os 18 minutos.</p><p>Próximo do apito final, o time treinado por Roberto Robles viu <a href=/player.php?id=235534>Jandrín</a> ser expulso ao receber o segundo amarelo.</p><p>Com o resultado, o Coruxo ocupa o sétimo lugar na <a href=/edicao.php?id_edicao=167018> tabela</a>, com 16 pontos, enquanto o Langreo encontra-se na décima quinta posição, 11 pontos. No próximo jogo do <a href=/edicao.php?id_edicao=167018>Segunda División RFEF</a>, a equipe do técnico Roberto Robles <a href=/match.php?id=8842294> joga em casa contra Bergantiños FC</a>, já a equipe de Coruxo - Vigo <a href=/match.php?id=8842295> desafia o Zamora fora de casa</a>.</p>","<p>Na décima primeira rodada, o <a href=/equipa.php?id=26491>Langreo</a> bateu o <a href=/equipa.php?id=11719>Coruxo</a>, por <a href=/match.php?id=8842285>0x1</a>, no domingo. Antes desta rodada, a equipe de Coruxo - Vigo vinha de uma vitória, e a equipe comandada por Roberto Robles vinha de duas derrotas.</p><p><a href=/player.php?id=663321>Óscar Poveda </a> marcou o gol que garantiu a vitória para o Langreo, quando o relógio assinalava os 18 minutos.</p><p>Próximo do apito final, o time treinado por Roberto Robles viu <a href=/player.php?id=235534>Jandrín</a> ser expulso ao receber o segundo amarelo.</p><p>Com o resultado, o Coruxo ocupa o sétimo lugar na <a href=/edicao.php?id_edicao=167018> tabela</a>, com 16 pontos, enquanto o Langreo encontra-se na décima quinta posição, 11 pontos. No próximo jogo do <a href=/edicao.php?id_edicao=167018>Segunda División RFEF</a>, a equipe do técnico Roberto Robles <a href=/match.php?id=8842294> joga em casa contra Bergantiños FC</a>, já a equipe de Coruxo - Vigo <a href=/match.php?id=8842295> desafia o Zamora fora de casa</a>.</p>","1","2022-11-20 23:59:59"
"3069291","8842280","Racing Santander B derrota o CD Cristo Atlético por 0x2","Racing Santander B derrota o CD Cristo Atlético por 0x2","<p>O <a href=/equipa.php?id=8470>Racing Santander B</a> levou a melhor sobre o <a href=/equipa.php?id=46489>CD Cristo Atlético</a> num duelo no domingo, por <a href=/match.php?id=8842280>0x2</a>, em jogo da décima primeira rodada. Antes desta partida, o time treinado por Chuchi vinha de três vitórias, e a equipe do técnico Ezequiel Loza vinha de um triunfo. <a href=/player.php?id=906351>Yeray Cabanzón </a> fez grande jogo.</p><p>Yeray Cabanzón inaugurou o marcador para o Racing Santander B quando o relógio assinalava os 42 minutos.</p><p>O meia decretou o placar final, depois de converter a cobrança de um pênaltiaos 81.</p><p>Com o resultado, o Racing Santander B ocupa o terceiro lugar na <a href=/edicao.php?id_edicao=167018> tabela</a>, com 19 pontos, enquanto o CD Cristo Atlético encontra-se na oitava posição, 16 pontos. No próximo jogo do <a href=/edicao.php?id_edicao=167018>Segunda División RFEF</a>, a equipe de Santander <a href=/match.php?id=8842289> joga em casa contra Valladolid B</a>. Por sua vez, o time treinado por Chuchi <a href=/match.php?id=8842290> visita o Marino</a>.</p>","<p>O <a href=/equipa.php?id=8470>Racing Santander B</a> levou a melhor sobre o <a href=/equipa.php?id=46489>CD Cristo Atlético</a> num duelo no domingo, por <a href=/match.php?id=8842280>0x2</a>, em jogo da décima primeira rodada. Antes desta partida, o time treinado por Chuchi vinha de três vitórias, e a equipe do técnico Ezequiel Loza vinha de um triunfo. <a href=/player.php?id=906351>Yeray Cabanzón </a> fez grande jogo.</p><p>Yeray Cabanzón inaugurou o marcador para o Racing Santander B quando o relógio assinalava os 42 minutos.</p><p>O meia decretou o placar final, depois de converter a cobrança de um pênaltiaos 81.</p><p>Com o resultado, o Racing Santander B ocupa o terceiro lugar na <a href=/edicao.php?id_edicao=167018> tabela</a>, com 19 pontos, enquanto o CD Cristo Atlético encontra-se na oitava posição, 16 pontos. No próximo jogo do <a href=/edicao.php?id_edicao=167018>Segunda División RFEF</a>, a equipe de Santander <a href=/match.php?id=8842289> joga em casa contra Valladolid B</a>. Por sua vez, o time treinado por Chuchi <a href=/match.php?id=8842290> visita o Marino</a>.</p>","1","2022-11-20 23:59:59"
"3066316","8842284","Bergantiños FC vence o Ourense CF por 1x0","Bergantiños FC vence o Ourense CF por 1x0","<p>O <a href=/equipa.php?id=13353>Bergantiños FC</a> derrotou o <a href=/equipa.php?id=19361>Ourense CF</a> num confronto equilibrado no sábado, por <a href=/match.php?id=8842284>1x0</a>, em jogo da décima primeira rodada. Antes desta rodada, a equipe de Carballo, Galicia vinha de um triunfo, e a equipe do técnico Rúben Rodriguez vinha de uma derrota.</p><p><a href=/player.php?id=324164>Carlos López</a> marcou o gol que garantiu a vitória para o Bergantiños FC, quando o relógio assinalava os 5 minutos. Carlos López já marca há 4 partidas seguidas.</p><p>Com o resultado, o Ourense CF ocupa o décimo segundo lugar na <a href=/edicao.php?id_edicao=167018> tabela</a>, com 15 pontos, enquanto o Bergantiños FC encontra-se na décima terceira posição, 14 pontos. Na próxima rodada do <a href=/edicao.php?id_edicao=167018>Segunda División RFEF</a>, o time do técnico José Ameneiro <a href=/match.php?id=8842294> encara o Langreo fora de casa.</a>. Por sua vez, a equipe do técnico Rúben Rodriguez <a href=/match.php?id=8842293> recebe o Gimnástica Torrelavega</a>.</p>","<p>O <a href=/equipa.php?id=13353>Bergantiños FC</a> derrotou o <a href=/equipa.php?id=19361>Ourense CF</a> num confronto equilibrado no sábado, por <a href=/match.php?id=8842284>1x0</a>, em jogo da décima primeira rodada. Antes desta rodada, a equipe de Carballo, Galicia vinha de um triunfo, e a equipe do técnico Rúben Rodriguez vinha de uma derrota.</p><p><a href=/player.php?id=324164>Carlos López</a> marcou o gol que garantiu a vitória para o Bergantiños FC, quando o relógio assinalava os 5 minutos. Carlos López já marca há 4 partidas seguidas.</p><p>Com o resultado, o Ourense CF ocupa o décimo segundo lugar na <a href=/edicao.php?id_edicao=167018> tabela</a>, com 15 pontos, enquanto o Bergantiños FC encontra-se na décima terceira posição, 14 pontos. Na próxima rodada do <a href=/edicao.php?id_edicao=167018>Segunda División RFEF</a>, o time do técnico José Ameneiro <a href=/match.php?id=8842294> encara o Langreo fora de casa.</a>. Por sua vez, a equipe do técnico Rúben Rodriguez <a href=/match.php?id=8842293> recebe o Gimnástica Torrelavega</a>.</p>","1","2022-11-19 23:59:59"
"3066317","8842286","Zamora derrota o SDC Polvorín por 0x2","Zamora derrota o SDC Polvorín por 0x2","<p>Em jogo válido pela décima primeira rodada do <a href=/edicao.php?id_edicao=167018>Segunda División RFEF</a>, o <a href=/equipa.php?id=6379>Zamora</a> bateu o <a href=/equipa.php?id=97951>SDC Polvorín</a>, por <a href=/match.php?id=8842286>0x2</a>, no sábado. Nesta competição, a equipe de Lugo vinha de um triunfo, e a equipe de Zamora vinha de dois vitórias.</p><p>A etapa inicial terminou em 0 a 0.</p><p><a href=/player.php?id=773066>Pana</a> inaugurou o placar, quando o relógio assinalava os 71 minutos. Em um lance infeliz, <a href=/player.php?id=662941>Carlos Torrado</a> marcou um gol contra já depois do tempo regulamentar.</p><p>Com o resultado, o Zamora ocupa o nono lugar na <a href=/edicao.php?id_edicao=167018> tabela</a>, com 16 pontos, enquanto o SDC Polvorín encontra-se na décima sétima posição, 10 pontos. Quanto à próxima rodada do Segunda División RFEF, a equipe de Zamora <a href=/match.php?id=8842295> recebe o Coruxo</a>. Por sua vez, a equipe de Lugo <a href=/match.php?id=8842296> desafia o Guijuelo fora de casa</a>.</p>","<p>Em jogo válido pela décima primeira rodada do <a href=/edicao.php?id_edicao=167018>Segunda División RFEF</a>, o <a href=/equipa.php?id=6379>Zamora</a> bateu o <a href=/equipa.php?id=97951>SDC Polvorín</a>, por <a href=/match.php?id=8842286>0x2</a>, no sábado. Nesta competição, a equipe de Lugo vinha de um triunfo, e a equipe de Zamora vinha de dois vitórias.</p><p>A etapa inicial terminou em 0 a 0.</p><p><a href=/player.php?id=773066>Pana</a> inaugurou o placar, quando o relógio assinalava os 71 minutos. Em um lance infeliz, <a href=/player.php?id=662941>Carlos Torrado</a> marcou um gol contra já depois do tempo regulamentar.</p><p>Com o resultado, o Zamora ocupa o nono lugar na <a href=/edicao.php?id_edicao=167018> tabela</a>, com 16 pontos, enquanto o SDC Polvorín encontra-se na décima sétima posição, 10 pontos. Quanto à próxima rodada do Segunda División RFEF, a equipe de Zamora <a href=/match.php?id=8842295> recebe o Coruxo</a>. Por sua vez, a equipe de Lugo <a href=/match.php?id=8842296> desafia o Guijuelo fora de casa</a>.</p>","1","2022-11-19 23:59:59"
"3066318","8842279","Laredo consegue vitória magra sobre o Valladolid B","Laredo consegue vitória magra sobre o Valladolid B","<p>Na décima primeira rodada, o <a href=/equipa.php?id=8471>Laredo</a> superou o <a href=/equipa.php?id=8465>Valladolid B</a>, por <a href=/match.php?id=8842279>0x1</a>, no sábado. Antes desta partida, o time treinado por Júlio Baptista vinha de um triunfo, e a equipe do técnico Chiri vinha de quatro derrotas.</p><p>O placar não foi inaugurado nos primeiros 45 minutos de partida.</p><p>No minuto 60, <a href=/player.php?id=826852>Diego Marta</a> marcou o único gol para o Laredo. Nos minutos finais, <a href=/player.php?id=774681>Fran López </a> deixou a partida após receber o cartão vermelho. Já depois do tempo regulamentar, o Valladolid B viu <a href=/player.php?id=784502>Iker Pérez</a> ser expulso com vermelho direto.</p><p>Com o resultado, o Valladolid B ocupa o sexto lugar na <a href=/edicao.php?id_edicao=167018> tabela</a>, com 18 pontos. O Laredo, por sua vez, fica na décima quarta posição, 13 pontos. No próximo jogo do <a href=/edicao.php?id_edicao=167018>Segunda División RFEF</a>, a equipe de Laredo <a href=/match.php?id=8842288> joga em casa contra Real Oviedo B</a>, enquanto o time treinado por Júlio Baptista <a href=/match.php?id=8842289> desafia o Racing Santander B fora de casa</a>.</p>","<p>Na décima primeira rodada, o <a href=/equipa.php?id=8471>Laredo</a> superou o <a href=/equipa.php?id=8465>Valladolid B</a>, por <a href=/match.php?id=8842279>0x1</a>, no sábado. Antes desta partida, o time treinado por Júlio Baptista vinha de um triunfo, e a equipe do técnico Chiri vinha de quatro derrotas.</p><p>O placar não foi inaugurado nos primeiros 45 minutos de partida.</p><p>No minuto 60, <a href=/player.php?id=826852>Diego Marta</a> marcou o único gol para o Laredo. Nos minutos finais, <a href=/player.php?id=774681>Fran López </a> deixou a partida após receber o cartão vermelho. Já depois do tempo regulamentar, o Valladolid B viu <a href=/player.php?id=784502>Iker Pérez</a> ser expulso com vermelho direto.</p><p>Com o resultado, o Valladolid B ocupa o sexto lugar na <a href=/edicao.php?id_edicao=167018> tabela</a>, com 18 pontos. O Laredo, por sua vez, fica na décima quarta posição, 13 pontos. No próximo jogo do <a href=/edicao.php?id_edicao=167018>Segunda División RFEF</a>, a equipe de Laredo <a href=/match.php?id=8842288> joga em casa contra Real Oviedo B</a>, enquanto o time treinado por Júlio Baptista <a href=/match.php?id=8842289> desafia o Racing Santander B fora de casa</a>.</p>","1","2022-11-19 23:59:59"
"3066181","8842272","Racing Santander B derrota o Real Avilés por 1x0","Racing Santander B derrota o Real Avilés por 1x0","<p>O <a href=/equipa.php?id=8470>Racing Santander B</a> bateu o <a href=/equipa.php?id=23617>Real Avilés</a> em um jogo equilibrado no domingo, por <a href=/match.php?id=8842272>1x0</a>, na décima rodada. Nesta competição, a equipe de Santander vinha de duas derrotas, e a equipe de Avilés vinha de duas vitórias.</p><p>A etapa inicial terminou em 0 a 0.</p><p>Aos 71, <a href=/player.php?id=820402>Ayoub Jabbari</a> marcou o único gol para o Racing Santander B.</p><p>Com o resultado, o Racing Santander B ocupa o sexto lugar na <a href=/edicao.php?id_edicao=167018> tabela</a>, com 16 pontos. O Real Avilés, por sua vez, fica na sétima posição, 15 pontos. Quanto à próxima rodada do <a href=/edicao.php?id_edicao=167018>Segunda División RFEF</a>, a equipe do técnico Ezequiel Loza <a href=/match.php?id=8842280> desafia o CD Cristo Atlético fora de casa</a>. Por sua vez, o time treinado por Emilio Cañedo <a href=/match.php?id=8842281> joga em casa contra Marino</a>.</p>","<p>O <a href=/equipa.php?id=8470>Racing Santander B</a> bateu o <a href=/equipa.php?id=23617>Real Avilés</a> em um jogo equilibrado no domingo, por <a href=/match.php?id=8842272>1x0</a>, na décima rodada. Nesta competição, a equipe de Santander vinha de duas derrotas, e a equipe de Avilés vinha de duas vitórias.</p><p>A etapa inicial terminou em 0 a 0.</p><p>Aos 71, <a href=/player.php?id=820402>Ayoub Jabbari</a> marcou o único gol para o Racing Santander B.</p><p>Com o resultado, o Racing Santander B ocupa o sexto lugar na <a href=/edicao.php?id_edicao=167018> tabela</a>, com 16 pontos. O Real Avilés, por sua vez, fica na sétima posição, 15 pontos. Quanto à próxima rodada do <a href=/edicao.php?id_edicao=167018>Segunda División RFEF</a>, a equipe do técnico Ezequiel Loza <a href=/match.php?id=8842280> desafia o CD Cristo Atlético fora de casa</a>. Por sua vez, o time treinado por Emilio Cañedo <a href=/match.php?id=8842281> joga em casa contra Marino</a>.</p>","1","2022-11-06 23:59:59"
